<?xml version="1.0" encoding="UTF-8"?>
<!DOCTYPE Config SYSTEM "org.sidiff.editrule.generator.serge.config.dtd" >
<Config>
	<MetaModel>
		<MainModel nsUri="http://www.eclipse.org/papyrus/MARTE/1"
			isProfile="true" />
		<RequiredModel nsUri="http://www.eclipse.org/uml2/4.0.0/UML" />
		<RequiredModel nsUri="http://www.eclipse.org/uml2/4.0.0/Types" />
	</MetaModel>

	<Transformations>
		<CREATE enable="true" />
		<DELETE enable="true" />
		<ATTACH enable="true" useSimpleNames="true" />
		<DETACH enable="true"/>
		<MOVE enable="true" allowReferenceSwitching="true"
			allowReferenceCombinations="true" />
		<MOVE_UP enable="true" />
		<MOVE_DOWN enable="true" />
		<SET_ATTRIBUTE enable="true" />
		<UNSET_ATTRIBUTE enable="true" />
		<SET_REFERENCE enable="true" />
		<UNSET_REFERENCE enable="true" />
		<ADD enable="true" />
		<REMOVE enable="true" />
		<CHANGE_LITERAL enable="true" allowLiteralSwitching="true" />
		<CHANGE_REFERENCE enable="true" />
	</Transformations>

	<ConsistencyLevel>
		<CreateMandatoryChildren enable="true" />
		<CreateMandatoryNeighbours enable="true" />
		<CreateMultiplicityPreconditions
			enable="true" />
	</ConsistencyLevel>

	<CompletnessLevel>
		<AbstractReplacements>
			<AbstractReplacement ruleType="CREATE_DELETE"
				reduceDanglings="true" />
			<AbstractReplacement ruleType="ATTACH_DETACH"
				reduceDanglings="false" />
			<AbstractReplacement ruleType="ADD_REMOVE"
				reduceDanglings="true" />
			<AbstractReplacement ruleType="MOVE"
				reduceDanglings="true" />
			<AbstractReplacement ruleType="MOVE_UP"
				reduceDanglings="true" />
			<AbstractReplacement ruleType="MOVE_DOWN"
				reduceDanglings="true" />
			<AbstractReplacement ruleType="SET_UNSET_ATTRIBUTE"
				reduceDanglings="true" />
			<AbstractReplacement ruleType="SET_UNSET_REFERENCE"
				reduceDanglings="true" />
			<AbstractReplacement ruleType="CHANGE_LITERAL"
				reduceDanglings="true" />
			<AbstractReplacement ruleType="CHANGE_REFERENCE"
				reduceDanglings="true" />
		</AbstractReplacements>
		<SupertypeReplacements>
			<SupertypeReplacement ruleType="CREATE_DELETE"
				reduceDanglings="true" reduceContext="true" />
			<SupertypeReplacement ruleType="ATTACH_DETACH"
				reduceDanglings="false" reduceContext="false" />
			<SupertypeReplacement ruleType="ADD_REMOVE"
				reduceDanglings="true" reduceContext="true" />
			<SupertypeReplacement ruleType="MOVE"
				reduceDanglings="true" reduceContext="true" />
			<SupertypeReplacement ruleType="MOVE_UP"
				reduceDanglings="true" reduceContext="true" />
			<SupertypeReplacement ruleType="MOVE_DOWN"
				reduceDanglings="true" reduceContext="true" />
			<SupertypeReplacement ruleType="SET_UNSET_ATTRIBUTE"
				reduceDanglings="true" reduceContext="true" />
			<SupertypeReplacement ruleType="SET_UNSET_REFERENCE"
				reduceDanglings="true" reduceContext="true" />
			<SupertypeReplacement ruleType="CHANGE_LITERAL"
				reduceDanglings="true" reduceContext="true" />
			<SupertypeReplacement ruleType="CHANGE_REFERENCE"
				reduceDanglings="true" reduceContext="true" />
		</SupertypeReplacements>

		<ModuleInternalOptions>
			<CreateOptionalAttributes enable="true" />
			<DanglingNodeSettings defaultTypeInclusion="always">
			</DanglingNodeSettings>
		</ModuleInternalOptions>

		<ModuleSetOptions>
			<ModuleGenerationSettings
				defaultGenerationCase="ifRequired">
				<GenerateModulesFor type="RtUnit" case="always" />
				<GenerateModulesFor type="PpUnit" case="always" />
			</ModuleGenerationSettings>
		</ModuleSetOptions>
	</CompletnessLevel>
</Config>