<?xml version="1.0" encoding="UTF-8"?>
<!DOCTYPE Config SYSTEM "org.sidiff.editrule.generator.serge.config.dtd" >

<Config>
	<MetaModel>
		<MainModel nsUri="http://www.eclipse.org/papyrus/0.7.0/SysML" isProfile="false" />
		<RequiredModel nsUri="http://www.eclipse.org/emf/2002/Ecore" />
		<RequiredModel nsUri="http://www.eclipse.org/uml2/4.0.0/UML" />
		<RequiredModel nsUri="http://www.eclipse.org/uml2/4.0.0/Types" />
		<RootModelElement name="Model" canBeNested="false" />
	</MetaModel>

	<Transformations>
		<CREATE enable="true" />
		<DELETE enable="true" />
		<MOVE enable="true" allowReferenceSwitching="true"
			allowReferenceCombinations="true" />
		<MOVE_UP enable="true" />
		<MOVE_DOWN enable="true" />
		<SET_ATTRIBUTE enable="true" />
		<UNSET_ATTRIBUTE enable="true" />
		<SET_REFERENCE enable="true" />
		<UNSET_REFERENCE enable="true" />
		<ADD enable="true" />
		<REMOVE enable="true" />
		<CHANGE_LITERAL enable="true" allowLiteralSwitching="true" />
		<CHANGE_REFERENCE enable="true" />
	</Transformations>

	<ConsistencyLevel>
		<CreateMandatoryChildren enable="true" />
		<CreateMandatoryNeighbours enable="true" />
		<CreateMultiplicityPreconditions
			enable="false" />
	</ConsistencyLevel>

	<CompletnessLevel>
		<AbstractReplacements>
			<AbstractReplacement ruleType="CREATE_DELETE"
				reduceDanglings="true" />
			<AbstractReplacement ruleType="ADD_REMOVE"
				reduceDanglings="true" />
			<AbstractReplacement ruleType="MOVE"
				reduceDanglings="true" />
			<AbstractReplacement ruleType="MOVE_UP"
				reduceDanglings="true" />
			<AbstractReplacement ruleType="MOVE_DOWN"
				reduceDanglings="true" />
			<AbstractReplacement ruleType="SET_UNSET_ATTRIBUTE"
				reduceDanglings="true" />
			<AbstractReplacement ruleType="SET_UNSET_REFERENCE"
				reduceDanglings="true" />
			<AbstractReplacement ruleType="CHANGE_LITERAL"
				reduceDanglings="true" />
			<AbstractReplacement ruleType="CHANGE_REFERENCE"
				reduceDanglings="true" />
		</AbstractReplacements>
		<SupertypeReplacements>
			<SupertypeReplacement ruleType="CREATE_DELETE"
				reduceDanglings="true" reduceContext="true" />
			<SupertypeReplacement ruleType="ADD_REMOVE"
				reduceDanglings="true" reduceContext="true" />
			<SupertypeReplacement ruleType="MOVE"
				reduceDanglings="true" reduceContext="true" />
			<SupertypeReplacement ruleType="MOVE_UP"
				reduceDanglings="true" reduceContext="true" />
			<SupertypeReplacement ruleType="MOVE_DOWN"
				reduceDanglings="true" reduceContext="true" />
			<SupertypeReplacement ruleType="SET_UNSET_ATTRIBUTE"
				reduceDanglings="true" reduceContext="true" />
			<SupertypeReplacement ruleType="SET_UNSET_REFERENCE"
				reduceDanglings="true" reduceContext="true" />
			<SupertypeReplacement ruleType="CHANGE_LITERAL"
				reduceDanglings="true" reduceContext="true" />
			<SupertypeReplacement ruleType="CHANGE_REFERENCE"
				reduceDanglings="true" reduceContext="true" />
		</SupertypeReplacements>

		<ModuleInternalOptions>
			<CreateOptionalAttributes enable="true" />
			<DanglingNodeSettings defaultTypeInclusion="ifRequired">
				<DanglingNodeSetting type="Block" include="always" />
				<DanglingNodeSetting type="FlowPort" include="always" />
				<DanglingNodeSetting type="ConstraintProperty"
					include="always" />
				<DanglingNodeSetting type="ConstraintBlock"
					include="always" />
				<DanglingNodeSetting type="RequirementRelated"
					include="always" />
				<DanglingNodeSetting type="Requirement" include="always" />
				<DanglingNodeSetting type="Satisfy" include="always" />
			</DanglingNodeSettings>
		</ModuleInternalOptions>

		<ModuleSetOptions>
			<ModuleGenerationSettings
				defaultGenerationCase="ifRequired">
				<GenerateModulesFor type="Block" case="always" />
				<GenerateModulesFor type="FlowPort" case="always" />
				<GenerateModulesFor type="ConstraintProperty"
					case="always" />
				<GenerateModulesFor type="ConstraintBlock"
					case="always" />
				<GenerateModulesFor type="RequirementRelated"
					case="always" />
				<GenerateModulesFor type="Requirement" case="always" />
				<GenerateModulesFor type="Satisfy" case="always" />
			</ModuleGenerationSettings>
		</ModuleSetOptions>
	</CompletnessLevel>
</Config>